{
  "schema_version": "multimodal-evidence-pack/v1",
  "base_context_id": "extraction-context:ad97c2227db631420b15f3534d7b179688d14e03f136ee349a2458ed715c52d3",
  "source_id": "source:1f568a3bacc674e6297c2fe0608f85ad0beaba40a68ddd51696d7de82866000f",
  "source_revision_hash": "a00d9b65c0d91ce7274d29509e4488a1dcd48642e4da93014061cc80438b2a50",
  "selection_id": "selection:eff105b6a77d129851db63d61be2688761ebc7bce1460f35dc4307d01ea9a3f2",
  "observation_hash": "778ec43ae8483e0569d34b256587527c629de5a7d33d95870b47ffcea2bb3f01",
  "images": [
    {
      "image_id": "primary:page_1:21e7563036a76ea79f5cacf40ae7edfdee4479525ecae62ab2089cdaf35950c5",
      "page_id": "page_1",
      "role": "primary",
      "artifact": {
        "artifact_id": "artifact:selection_crop:21e7563036a76ea79f5cacf40ae7edfdee4479525ecae62ab2089cdaf35950c5",
        "kind": "selection_crop",
        "sha256": "21e7563036a76ea79f5cacf40ae7edfdee4479525ecae62ab2089cdaf35950c5",
        "media_type": "image/png",
        "byte_size": 122573
      },
      "width": 1683,
      "height": 376
    }
  ],
  "printed_text": [
    {
      "observation_id": "observation:text:7f0b5a8f72fd583f60ea725f5e0f250ceef394b23bab2137c9f23bc9ed4f780a",
      "page_id": "page_1",
      "reading_order": 2,
      "confidence": 0.975971,
      "text": "(II)当a=2时,点A(-1,0)和点D在该抛物线上,点C为抛物线与y轴的交点,且∠CAD=90°,AC=AD,求点"
    },
    {
      "observation_id": "observation:text:e2c31e14095391e4b41e8ba00b5640caa39b1a5c6ac1e58dfcf86c70f7a0ab20",
      "page_id": "page_1",
      "reading_order": 3,
      "confidence": 0.995922,
      "text": "D的坐标;"
    },
    {
      "observation_id": "observation:text:5afe61d1e21279b348d39dc06a8db0ee98505469652b9c06c78c8d2ec320d022",
      "page_id": "page_1",
      "reading_order": 4,
      "confidence": 0.951386,
      "text": "(IIII)当a=1时,点A(-1,0)在该抛物线上,且有点M(b+"
    },
    {
      "observation_id": "observation:text:d6753158f1cbbd3a6a57379e94376c99991a0f2f195cc2bdd2dc64cc5ef4717f",
      "page_id": "page_1",
      "reading_order": 5,
      "confidence": 0.999966,
      "text": "1"
    },
    {
      "observation_id": "observation:text:e61debfcedc0e5227f022d8399092b926f088014a048d675122c396630b59cb3",
      "page_id": "page_1",
      "reading_order": 6,
      "confidence": 0.999997,
      "text": "2"
    },
    {
      "observation_id": "observation:text:c5a72c54e506b9d350984c353dbc0bb6775933d94d3be46090e0d6d914a35455",
      "page_id": "page_1",
      "reading_order": 7,
      "confidence": 0.991596,
      "text": ",yM)在抛物线上,点N(n,0)是x轴正半轴上的动点,"
    },
    {
      "observation_id": "observation:text:7a1dfa8dc80848fa0dcc3d3e91f8d2f612e7ff7cc7bff5660dbff5795af1077c",
      "page_id": "page_1",
      "reading_order": 8,
      "confidence": 0.963861,
      "text": "当√2MN + AN的最小值为"
    },
    {
      "observation_id": "observation:text:80d0d1e614abde7e0b522496b579ecd0a8f00e43a09e1669559258376b78c2d1",
      "page_id": "page_1",
      "reading_order": 9,
      "confidence": 0.999998,
      "text": "21"
    },
    {
      "observation_id": "observation:text:3d2b90184279c0a292068aa7c39983058cfb122310bf6b33466d7920dba20e58",
      "page_id": "page_1",
      "reading_order": 10,
      "confidence": 0.999993,
      "text": "4"
    },
    {
      "observation_id": "observation:text:38099cb6a017fbc75bb4c28fbb1d681e10467b1fdf430679d5192ad3f6242ab2",
      "page_id": "page_1",
      "reading_order": 11,
      "confidence": 0.991158,
      "text": "时,求b的值."
    },
    {
      "observation_id": "observation:text:f26c43414bae3d7e07db2189c6e2632f69f69cb5d7344bea9e1564836092c5ab",
      "page_id": "page_1",
      "reading_order": 12,
      "confidence": 0.999088,
      "text": "作业帮"
    }
  ],
  "recognized_formulas": [
    {
      "observation_id": "observation:formula:f508dca2e75acb3acbf8ce2e45123605410542e0c4127d43fd9ce37b8bc2f938",
      "page_id": "page_1",
      "reading_order": 0,
      "confidence": 0.5,
      "latex": "a=2"
    }
  ],
  "unresolved_items": [
    {
      "work_item_id": "unresolved:21f4db562220f841083f00c09d3bb25d2c08b44154ef795df861fdf639816cd1",
      "code": "extraction.formula_observation_unresolved",
      "region_refs": [
        "observation:formula:4f2287fe16ad459c22a6467418f6b1c0c20778a905a26b2c03b44d7954144fb1"
      ],
      "hint": "a=1"
    },
    {
      "work_item_id": "unresolved:3678b688578eb79f6d5f23f1ff50cf4fe627bf71462aa357365b862b0f9bc116",
      "code": "extraction.formula_observation_unresolved",
      "region_refs": [
        "observation:text:59f776a8d1483f418dc13ddb32dec45ceec31da784f539218ec49ae6dabc8c14",
        "observation:text:ab97ed1f95fae563d4839d7f3866be72f2594e373ac6ab8dcfe11e5aab18a8e2"
      ],
      "hint": null
    },
    {
      "work_item_id": "unresolved:441a7307e2b2e1a42f55b77854cacdf05b5d2a44fa80d48c985ad454ab54fb7a",
      "code": "extraction.observation_origin_unresolved",
      "region_refs": [
        "observation:text:59f776a8d1483f418dc13ddb32dec45ceec31da784f539218ec49ae6dabc8c14"
      ],
      "hint": "25. (10分)已知抛物线y = ax2 −bx + c,(a,b,c为常数,b >0)."
    },
    {
      "work_item_id": "unresolved:4ef9fa06fe588aec0225d47d028ac179ee6daaa519d9a6ff05aa464afe3d8d81",
      "code": "extraction.formula_observation_unresolved",
      "region_refs": [
        "observation:text:7f0b5a8f72fd583f60ea725f5e0f250ceef394b23bab2137c9f23bc9ed4f780a"
      ],
      "hint": null
    },
    {
      "work_item_id": "unresolved:536e2fadc7405c29fed640eae25f4be87d53f7ad62948e8317d149f16279e85f",
      "code": "extraction.formula_observation_unresolved",
      "region_refs": [
        "observation:formula:df8357ea81099ba8845ce4e4c7138512cd567aa98f6a225fcc238b0a241ccb6d"
      ],
      "hint": "A(-1,0)"
    },
    {
      "work_item_id": "unresolved:577ecf2da9ec0ab68950ecfa8334975948f8fe4d9863776ff9da3aa1b0073ed8",
      "code": "extraction.formula_observation_unresolved",
      "region_refs": [
        "observation:formula:05ea2168c0c4b20839c24498c499247de2df0c5a5afd8f70ec8113d4d0201f39"
      ],
      "hint": "A(-1,0)"
    },
    {
      "work_item_id": "unresolved:9701b27ae9f7e9d94dbee964a957488958504adb5d8c2e5f7446ecde19912d73",
      "code": "extraction.observation_origin_unresolved",
      "region_refs": [
        "observation:text:ab97ed1f95fae563d4839d7f3866be72f2594e373ac6ab8dcfe11e5aab18a8e2"
      ],
      "hint": "(I)当a = 1,b = 2,c =3时,求该抛物线顶点P的坐标;"
    },
    {
      "work_item_id": "unresolved:a11de472f4d269612c3fbbf0527cf2b5ffb25913ed827354ea40a3ef2f1f3cc1",
      "code": "extraction.observation_confidence_low",
      "region_refs": [
        "observation:layout:a0c40dbbeacc3102129421b91879de6e0ae7ead3b0dc92fd9f7ff1a472e2c212"
      ],
      "hint": null
    },
    {
      "work_item_id": "unresolved:d2fe06d4cc12602e93c7a9afb5128a77533872df69a92dcc2bff455bc263b69b",
      "code": "extraction.formula_observation_unresolved",
      "region_refs": [
        "observation:formula:ec0e7a1cf1058c51d07bb40a4806cf35cc4fded13b6deb25f45a8f275fb5baf7"
      ],
      "hint": "√2MN + AN"
    },
    {
      "work_item_id": "unresolved:f1d58d9f834eedbf3831960a2ea8a824088d1fecedd0720a9ef2598d4f46f49d",
      "code": "extraction.formula_observation_unresolved",
      "region_refs": [
        "observation:text:7a1dfa8dc80848fa0dcc3d3e91f8d2f612e7ff7cc7bff5660dbff5795af1077c"
      ],
      "hint": null
    },
    {
      "work_item_id": "unresolved:f739f4f2f8323f946bc6d4220ad4b512dad9004fe9faaf2d11abc60bb4369c79",
      "code": "extraction.formula_observation_unresolved",
      "region_refs": [
        "observation:formula:3510d24bce3ca56646dbd876ad459bab3edba460db52effe9b142fefc3c43193"
      ],
      "hint": "∠CAD=90°,AC=AD"
    },
    {
      "work_item_id": "unresolved:f7a4cea34acfd8f0db96ebfcc81a66857e0e9a26703ec2417314ac2738aa91cd",
      "code": "extraction.formula_observation_unresolved",
      "region_refs": [
        "observation:text:5afe61d1e21279b348d39dc06a8db0ee98505469652b9c06c78c8d2ec320d022"
      ],
      "hint": null
    }
  ],
  "region_index": [
    {
      "region_id": "observation:formula:f508dca2e75acb3acbf8ce2e45123605410542e0c4127d43fd9ce37b8bc2f938",
      "evidence_id": "observation:formula:f508dca2e75acb3acbf8ce2e45123605410542e0c4127d43fd9ce37b8bc2f938",
      "page_id": "page_1",
      "polygon": [
        [
          0.127432,
          0.821566
        ],
        [
          0.127432,
          0.844284
        ],
        [
          0.179587,
          0.844284
        ],
        [
          0.179587,
          0.821566
        ]
      ],
      "kind": "formula",
      "origin": "printed",
      "confidence": 0.5,
      "reading_order": 0,
      "source_artifact_id": "artifact:canonical_source_page:76aa1e773d6911d824f3ed64f310e6bb6fc5fda4b5b77659f540ca205c490688"
    },
    {
      "region_id": "observation:text:59f776a8d1483f418dc13ddb32dec45ceec31da784f539218ec49ae6dabc8c14",
      "evidence_id": "observation:text:59f776a8d1483f418dc13ddb32dec45ceec31da784f539218ec49ae6dabc8c14",
      "page_id": "page_1",
      "polygon": [
        [
          0.040525,
          0.76683
        ],
        [
          0.040525,
          0.78825
        ],
        [
          0.548516,
          0.789474
        ],
        [
          0.548516,
          0.768054
        ]
      ],
      "kind": "text",
      "origin": "unknown",
      "confidence": 0.896962,
      "reading_order": 0,
      "source_artifact_id": "artifact:canonical_source_page:76aa1e773d6911d824f3ed64f310e6bb6fc5fda4b5b77659f540ca205c490688"
    },
    {
      "region_id": "observation:formula:df8357ea81099ba8845ce4e4c7138512cd567aa98f6a225fcc238b0a241ccb6d",
      "evidence_id": "observation:formula:df8357ea81099ba8845ce4e4c7138512cd567aa98f6a225fcc238b0a241ccb6d",
      "page_id": "page_1",
      "polygon": [
        [
          0.209615,
          0.821566
        ],
        [
          0.209615,
          0.844284
        ],
        [
          0.29812,
          0.844284
        ],
        [
          0.29812,